,jobTitle,company,salary
7,Java Full stack Developer,Virtusa Consulting Services Pvt Ltd,"5,00,000 - 14,00,000 PA."
13,AWS Senior Cloud Engineer-5-9 Years,Virtusa Consulting Services Pvt Ltd,"7,00,000 - 17,00,000 PA."
17,Check JD - Permanent Opening For Java+Azure+Spring Boot+DevOps+Github,Tech Mahindra Ltd.,"50,000 - 2,00,000 PA."
18,Check JD -Permanent Opening Java+Azure+Github Backend /.Netcore+Devops,Tech Mahindra Ltd.,"50,000 - 2,25,000 PA."
20,Virual Walk-in For Big Data Engineer (Hadoop),Wipro,"4,00,000 - 9,00,000 PA."
26,UI Developer,COLLABERA,"10,00,000 - 13,00,000 PA."
28,SAP ABAP Consultant (C2H),COLLABERA,"5,00,000 - 15,00,000 PA."
35,Dot Net Developer with Azure,Mindtree Limited,"50,000 - 3,00,000 PA."
36,Genpact is hiring For SAP PS Immediate joiners,GENPACT India Private Limited,"4,00,000 - 9,00,000 PA."
37,SAP CRM Technical Consultant,Tech Mahindra Ltd.,"6,50,000 - 15,00,000 PA."
45,Java Fullstack- Mumbai/Bangalore,Virtusa Consulting Services Pvt Ltd,"5,00,000 - 14,00,000 PA."
46,Peoplesoft Developer,Virtusa Consulting Services Pvt Ltd,"5,00,000 - 15,00,000 PA."
51,Principal Application Developer-UI,Oracle India Pvt. Ltd.,"20,00,000 - 30,00,000 PA."
56,Urgent opening For Oracle Cloud EPM consultant,Hexaware Technologies Ltd.,"9,50,000 - 19,50,000 PA."
57,KPMG hiring Technical Sourcer on Immediate Basis!!!,KPMG,"50,000 - 2,75,000 PA."
62,Fresher - B.E/BTech (Only CSE/IT) Year of Pass out 2019,COLLABERA,"50,000 - 2,25,000 PA."
63,Job Opportunity For Fresher -B.E/BTech (Only CSE/IT) Passout 2020 Only,COLLABERA,"50,000 - 2,25,000 PA."
75,Java Developer (Microservices) C2H,COLLABERA,"2,00,000 - 7,00,000 PA."
80,Servicenow Developer (ITOM OR HR OR Service portal),RANDSTAD INDIA PVT LTD,"3,00,000 - 8,00,000 PA."
84,Java Developer,COLLABERA,"3,00,000 - 7,50,000 PA."
85,Dot Net Developer,COLLABERA,"3,00,000 - 7,50,000 PA."
86,SAP SD Consultant,COLLABERA,"3,00,000 - 7,50,000 PA."
87,SAP ABAP Consultant,COLLABERA,"3,00,000 - 7,50,000 PA."
88,SAP ABAP Hana Consultant,COLLABERA,"3,00,000 - 7,50,000 PA."
89,Mainframe Tester,COLLABERA,"3,00,000 - 7,50,000 PA."
90,Mainframe Developer,COLLABERA,"3,00,000 - 7,50,000 PA."
91,Manual Automation Test Engineer,COLLABERA,"3,00,000 - 7,50,000 PA."
92,API Testing,COLLABERA,"3,00,000 - 7,50,000 PA."
93,Automation Tester,COLLABERA,"3,00,000 - 7,50,000 PA."
94,Urgent opening For Automation Engineer_Immediate joiners,Synechron Technologies Pvt Ltd,"10,00,000 - 20,00,000 PA."
107,Permanent Employment - 6+ Yrs - .Net FullStack - Java Developer,Tech Mahindra Ltd.,"50,000 - 1,50,000 PA."
108,Site core Developer,Tata Consultancy Services Ltd.,"4,00,000 - 9,00,000 PA."
110,"Russian Language - Read, Write & Speak",GlobalLogic Technologies Limited,"2,00,000 - 3,00,000 PA."
113,Adobe Analytics - Tata Consultancy Services,Tata Consultancy Services Ltd.,"6,00,000 - 16,00,000 PA."
115,Presale Solution Architect,Tech Mahindra Ltd.,"50,000 - 3,00,000 PA."
116,RPA UI Path_Production Suport Role _Hexaware Permanent _Anywhere India,HEXAWARE TECHNOLOGIES LIMITED,"7,00,000 - 14,00,000 PA."
119,RF Engineer (RF Optimization : Ericsson) -Gurgaon,Amdocs Development Centre India LLP,"4,00,000 - 8,00,000 PA."
122,Customer Service Executive(Voice),Trigent Software,"50,000 - 1,50,000 PA."
123,Customer Service Executive(Voice),Trigent Software,"50,000 - 1,50,000 PA."
131,Senior Application Developer-UI,Oracle India Pvt. Ltd.,"9,00,000 - 15,00,000 PA."
141,Hiring For SFDC Vlocity Professionals - PAN India,Tech Mahindra Ltd.,"8,00,000 - 18,00,000 PA."
142,Job opening at Tech Mahindra,Tech Mahindra Ltd.,"50,000 - 3,00,000 PA."
146,Presales Consultant (ITSM - ServiceNow),Hexaware Technologies Ltd.,"10,00,000 - 20,00,000 PA."
153,Lead Java Position,Larsen & Toubro Infotech Limited,"18,00,000 - 25,00,000 PA."
156,Be/B.Tech Fresher - CS& IT,COLLABERA,"2,00,000 - 2,25,000 PA."
159,Hiring For Axiom Developer,Tata Consultancy Services Ltd.,"8,00,000 - 18,00,000 PA."
161,B.E/BTech (Only CSE/IT) :: Pan India,COLLABERA,"2,00,000 - 2,25,000 PA."
163,SAP PP QM Consultant,Tata Consultancy Services Ltd.,"8,00,000 - 16,00,000 PA."
171,Angular Developer,HCL Technologies Limited,"4,00,000 - 9,00,000 PA."
176,LTI is Hiring For Tibco BW - Mumbai/Pune/Bangalore/Chennai/Hyderabad,Larsen & Toubro Infotech Limited,"4,00,000 - 9,00,000 PA."
177,Hiring For UI Developer- Immediate Joiners- C2H,Affluent Global Services Pvt. Ltd.,"10,00,000 - 16,00,000 PA."
189,Java Spring Boot Developer || Immediate Hiring,COLLABERA,"1,00,000 - 5,50,000 PA."
190,React JS Developer| Velocis Systems Private Limited| Noida,Velocis Systems Pvt. Ltd.,"5,00,000 - 14,00,000 PA."
191,Immediate Hiring For Reacts Developer,Bristlecone India Limited,"7,00,000 - 17,00,000 PA."
193,"Financial Analyst/Senior Financial Analyst with Rackspace, #1Managed",TriCore Solutions Private Limited,"8,00,000 - 18,00,000 PA."
194,"IT Recruiter (C2H) with Rackspace, the #1 Managed cloud services!!",TriCore Solutions Private Limited,"5,00,000 - 12,00,000 PA."
195,Unity 3D Developer,InfraSoft Technologies Ltd,"4,00,000 - 9,00,000 PA."
199,Oracle EBS Technical Consultant,COLLABERA,"10,00,000 - 14,00,000 PA."
205,Tcs-Documentum Professional_Urgent_Pan India,Tata Consultancy Services Ltd.,"8,00,000 - 18,00,000 PA."
239,Non IT Recruiter,Trigent Software,"1,50,000 - 5,00,000 PA."
240,Partner Sales,Progressive Infotech Pvt Ltd.,"4,00,000 - 9,00,000 PA."
241,IT Recruiter,Trigent Software,"1,50,000 - 5,00,000 PA."
243,"Plsql Developer - OFSS- Bangalore, Mumbai",Oracle India Pvt. Ltd.,"10,00,000 - 15,00,000 PA."
257,Zuora Consultant,Pearson Education India,"3,50,000 - 7,00,000 PA."
264,Zuora Consultant,Pearson Education India,"3,50,000 - 7,00,000 PA."
273,Senior Consultant - SAP GRC/S4HANA Security,Larsen & Toubro Infotech Limited,"10,00,000 - 20,00,000 PA."
274,Opening For SAP Basis Consultant - Immediate - 30 days,Larsen & Toubro Infotech Limited,"6,00,000 - 16,00,000 PA."
276,Hiring For Security Pre-Sales Consultant / Architect,Hexaware Technologies Ltd.,"15,00,000 - 30,00,000 PA."
281,LTI Hiring For (Core JAVA + Spring boot )Developer,Larsen & Toubro Infotech Limited,"10,00,000 - 18,00,000 PA."
284,ETL Tester,COLLABERA,"3,00,000 - 8,00,000 PA."
291,Microservices Developer,Oracle Financial Services Software,"10,00,000 - 18,00,000 PA."
302,Microservices Developer,Oracle Financial Services Software,"10,00,000 - 18,00,000 PA."
314,"Urgent Opening For JAVA,Angular,Springboot- OFSS- Pune,MumBang/Chen",Oracle India Pvt. Ltd.,"50,000 - 3,00,000 PA."
317,Intune,ATOS GLOBAL IT SOLUTIONS AND SERVICES PVT LTD,"10,00,000 - 15,00,000 PA."
318,Java Developer-Banking,Oracle India Pvt. Ltd.,"10,00,000 - 14,00,000 PA."
329,C++ Developer,COLLABERA,"8,50,000 - 18,50,000 PA."
332,Excellent opportunities with Collabera,COLLABERA,"5,00,000 - 8,00,000 PA."
341,Urgent Opening For Springboot Developer_Permanant,Synechron Technologies Pvt Ltd,"10,00,000 - 20,00,000 PA."
350,LTI is Hiring Automation Testers,Larsen & Toubro Infotech Limited,"2,50,000 - 7,50,000 PA."
362,Hiring For SAP ABAP Consultants ! Apply Now....,ZETTAMINE LABS PRIVATE LIMITED,"3,00,000 - 8,00,000 PA."
363,Looking For Senior Python Developer For part time position.,Platinus Technologies Private Limited,"2,00,000 - 5,50,000 PA."
369,Opportunity For role of .Net developer with Wolters,Allegis Services India Pvt. Ltd.,"5,00,000 - 14,00,000 PA."
386,Nagarro- Techsupport(Webapi&Sqlserver)-PAN India,Nagarro Software Pvt. Ltd,"4,50,000 - 9,50,000 PA."
392,Urgent opening For IOS Developer_ Permanent_Apply For immediate joiner,Synechron Technologies Pvt Ltd,"10,00,000 - 20,00,000 PA."
395,Urgent opening For DaaS Platform Engineer,Synechron Technologies Pvt Ltd,"10,00,000 - 20,00,000 PA."
396,SAP Security & GRC Consultant,COLLABERA,"3,00,000 - 7,50,000 PA."
397,Urgent opening For IAAS Platform Engineer_Permanant,Synechron Technologies Pvt Ltd,"10,00,000 - 20,00,000 PA."
398,opportunity For role of Full stack java developer profile,Allegis Services India Pvt. Ltd.,"10,00,000 - 19,00,000 PA."
399,opportunity For role of Full stack java developer profile,Allegis Services India Pvt. Ltd.,"10,00,000 - 19,00,000 PA."
402,Urgent opening For DaaS Platform Engineer,Synechron Technologies Pvt Ltd,"10,00,000 - 20,00,000 PA."
403,SAP Security & GRC Consultant,COLLABERA,"3,00,000 - 7,50,000 PA."
404,Urgent opening For IAAS Platform Engineer_Permanant,Synechron Technologies Pvt Ltd,"10,00,000 - 20,00,000 PA."
405,opportunity For role of Full stack java developer profile,Allegis Services India Pvt. Ltd.,"10,00,000 - 19,00,000 PA."
406,opportunity For role of Full stack java developer profile,Allegis Services India Pvt. Ltd.,"10,00,000 - 19,00,000 PA."
407,opportunity For role of Full stack java developer profile,Allegis Services India Pvt. Ltd.,"10,00,000 - 19,00,000 PA."
408,opportunity For role of Full stack java developer profile,Allegis Services India Pvt. Ltd.,"10,00,000 - 19,00,000 PA."
411,Full Stack Java Developer,COLLABERA,"7,00,000 - 8,50,000 PA."
414,Urgent Opening For Hadoop Developer_Permanant,Synechron Technologies Pvt Ltd,"15,00,000 - 30,00,000 PA."
417,.Net Developer _ 15day notice.,Synechron Technologies Pvt Ltd,"3,50,000 - 8,50,000 PA."
419,Opportunity For role of .Net fullstack developer with Wolters,Allegis Services India Pvt. Ltd.,"5,00,000 - 14,00,000 PA."
420,Genpact is hiring For Java Angular developer ! (Only Imm To 30 days ),Genpact Headstrong Capital Markets,"3,00,000 - 8,00,000 PA."
429,Sr SOA Engineer - Product Based Client,COLLABERA,"5,00,000 - 14,00,000 PA."
435,Azure Data Engineer,Mindteck (India) Ltd,"12,00,000 - 19,00,000 PA."
436,ReactJS Developer - Product Based Client,COLLABERA,"5,00,000 - 14,00,000 PA."
439,Core Java Developer,Tech Mahindra Ltd.,"3,00,000 - 8,00,000 PA."
440,Azure Data Engineer,Mindteck (India) Ltd,"12,00,000 - 19,00,000 PA."
441,ReactJS Developer - Product Based Client,COLLABERA,"5,00,000 - 14,00,000 PA."
444,Core Java Developer,Tech Mahindra Ltd.,"3,00,000 - 8,00,000 PA."
447,Urgently hiring Digital Marketing Executive For Growing Gaming Studio,IDZ Digital Pvt. Ltd,"1,50,000 - 2,00,000 PA."
448,Urgent opening For IOS Developer,Synechron Technologies Pvt Ltd,"10,00,000 - 20,00,000 PA."
452,Nodejs Developer with Leading MNC on Payroll of Randstad,RANDSTAD INDIA PVT LTD,"9,00,000 - 18,00,000 PA."
460,Microstrategy Developer,ALLIANZ SERVICES PRIVATE LIMITED,"5,00,000 - 9,00,000 PA."
463,We are hiring salesforce developer ( immediate Joiners),Calpion Software Technologies Pvt. Ltd,"50,000 - 3,00,000 PA."
477,Job | Java / Java Full stack Developer,Cibersites India Private Limited,"5,50,000 - 15,50,000 PA."
483,Job | Java / Java Full stack Developer,Cibersites India Private Limited,"5,50,000 - 15,50,000 PA."
495,Opening For Java Fullstack Developer!,Newt Global India Private Limited,"5,00,000 - 12,00,000 PA."
496,Opening For Cloud Native Engineering – DevOps,Newt Global India Private Limited,"4,00,000 - 9,00,000 PA."
500,Opening For Java Fullstack Developer!,Newt Global India Private Limited,"5,00,000 - 12,00,000 PA."
501,Opening For Cloud Native Engineering – DevOps,Newt Global India Private Limited,"4,00,000 - 9,00,000 PA."
505,Urgent requirement For ETL data engineer,PPN Solutions Pvt Ltd.,"6,00,000 - 8,00,000 PA."
509,RPA Developer,Software Data India Ltd.,"5,00,000 - 11,00,000 PA."
510,Web Application Developer,MNC,"11,00,000 - 17,00,000 PA."
511,Java QA Automation,MNC,"6,00,000 - 15,00,000 PA."
512,Mobile Application Developer,MNC,"11,00,000 - 18,00,000 PA."
515,Java Developer,MNC,"16,00,000 - 25,00,000 PA."
522,Powerapps and PowerAutomate Opportunity,CBSI India Pvt. Ltd.,"10,00,000 - 16,00,000 PA."
526,Job Opening For Data Designer- Tech BA For one of our client .,Vinsys IT Services (I) Private Limited,"10,00,000 - 15,00,000 PA."
530,Hiring ReactJS developer For Newt Global,Newt Global India Private Limited,"5,00,000 - 15,00,000 PA."
531,Salesforce Developer,Accenture Solutions Pvt Ltd,"5,00,000 - 15,00,000 PA."
532,Informatica Developer,Accenture Solutions Pvt Ltd,"5,00,000 - 15,00,000 PA."
533,Hiring Mern stack resources For PAN India,Newt Global India Private Limited,"5,00,000 - 15,00,000 PA."
549,Genesys Administrative,Cignex Datamatics Technologies Limited,"9,50,000 - 17,00,000 PA."
552,SAP_developer,Accenture Solutions Pvt Ltd,"5,00,000 - 15,00,000 PA."
553,Data Analyst,AG Technologies pvt Ltd,"2,00,000 - 4,00,000 PA."
554,Data Analyst,AG Technologies pvt Ltd,"2,00,000 - 4,00,000 PA."
555,Immediate Opening For Position Java Inventory @ Capgemini,Capgemini,"3,00,000 - 8,00,000 PA."
564,Looking For Senior QA Engineer For part time position.(Freelancer),Platinus Technologies Private Limited,"2,00,000 - 5,50,000 PA."
565,Looking For Senior Java Developer For part time position.(Freelancer),Platinus Technologies Private Limited,"2,00,000 - 5,50,000 PA."
566,Looking For Full Stack Java Developer For part time position.,Platinus Technologies Private Limited,"2,00,000 - 5,50,000 PA."
567,Looking For Senior DevOps engineer For part time position.(Freelancer),Platinus Technologies Private Limited,"2,00,000 - 5,50,000 PA."
568,Full Time Corporate Trainer - Citrix (Work from Home),Koenig Solutions Ltd,"9,00,000 - 19,00,000 PA."
570,Job | Urgent Opening with V2 Solutions For Backend Developer,V2Solutions,"4,00,000 - 9,00,000 PA."
573,Customer Service Representative,Trigent Software,"1,25,000 - 3,75,000 PA."
574,Customer Service Representative,Trigent Software,"1,25,000 - 3,75,000 PA."
595,Cyber Security - Data Privacy,Pricewaterhouse Coopers Private Limited,"5,00,000 - 12,00,000 PA."
596,Cyber Security - Identity and Access Management,Pricewaterhouse Coopers Private Limited,"5,00,000 - 12,00,000 PA."
601,Cyber Security - Data Privacy,Pricewaterhouse Coopers Private Limited,"5,00,000 - 12,00,000 PA."
602,Cyber Security - Identity and Access Management,Pricewaterhouse Coopers Private Limited,"5,00,000 - 12,00,000 PA."
614,Back Office Executive,Trigent Software,"50,000 - 1,50,000 PA."
638,Immediate Opening For .NET SQL Developer/Renown MNC/WFH AS OF NOW,RANDSTAD INDIA PVT LTD,"4,00,000 - 9,00,000 PA."
651,Customer Service Representative,Trigent Software,"1,25,000 - 5,00,000 PA."
652,Customer Service Representative,Trigent Software,"1,25,000 - 5,00,000 PA."
653,Customer Service Representative,Trigent Software,"1,25,000 - 5,00,000 PA."
654,Customer Service Representative,Trigent Software,"1,25,000 - 5,00,000 PA."
660,Plsql Developer,Oracle India Pvt. Ltd.,"11,00,000 - 21,00,000 PA."
679,Looking For Bench sales recruiter (Work from Home),Platinus Technologies Private Limited,"1,00,000 - 6,00,000 PA."
686,Looking For Bench sales recruiter (Work from Home),Platinus Technologies Private Limited,"1,00,000 - 6,00,000 PA."
696,Non IT Recruiter,Trigent Software,"1,50,000 - 5,00,000 PA."
697,IT Recruiter,Trigent Software,"1,50,000 - 5,00,000 PA."
699,Urgent opening Android Developer_Permanant,Synechron Technologies Pvt Ltd,"7,00,000 - 17,00,000 PA."
709,Immediate Vacancies On Automation/Selenium/Java_C2H_MNC,Sureminds Solutions Pvt. Ltd.,"50,000 - 1,25,000 PA."
711,Immediate Opening For Position Sail point Developer @ Wipro,URS Systems Private Limited,"3,00,000 - 8,00,000 PA."
716,Job Vacancy For PHP Developer | CHETU |,Chetu,"50,000 - 3,00,000 PA."
721,SAP Technical Architect - ABAP HANA with Fiori & Odata,BLOCKNIT TECHNOLOGIES INDIA PRIVATE LIMITED,"12,00,000 - 20,00,000 PA."
722,PHP Web Developer,T- WEB EXPONENT SERVICES PRIVATE LIMITED,"2,00,000 - 5,50,000 PA."
723,Grab An Opportunity That Best Suits your Career!!! PHP Developers,DBXento Systems Pvt. Ltd.,"4,25,000 - 9,25,000 PA."
724,Senior ETL Developer,Kloutix Solutions Pvt. Ltd,"8,00,000 - 18,00,000 PA."
752,Urgent opening For Senior Power BI Developer / Lead,Hexaware Technologies Ltd.,"8,00,000 - 18,00,000 PA."
754,Automation Anywhere,HEXAWARE TECHNOLOGIES LIMITED,"10,00,000 - 18,00,000 PA."
756,Business Analyst-Data Migration,HEXAWARE TECHNOLOGIES LIMITED,"10,00,000 - 20,00,000 PA."
757,Blueprism Certified Technical Lead,HEXAWARE TECHNOLOGIES LIMITED,"10,00,000 - 18,00,000 PA."
758,Hiring For SAP Bo with Crystal Reports - Chennai/Mumbai/Pune,Hexaware Technologies Ltd.,"5,50,000 - 15,50,000 PA."
760,Business Analyst Work from Home,DATA ERPSYSTEMS INDIA PRIVATE LIMITED,"6,50,000 - 9,00,000 PA."
761,Blockchain Developer,SI Telecom Pvt. Ltd.,"6,00,000 - 12,00,000 PA."
763,Agile Coach Full Remote,DATA ERPSYSTEMS INDIA PRIVATE LIMITED,"8,50,000 - 9,00,000 PA."
764,Angular Developer (100% Remote/ Work-From-Hom),Think bridge Software Pvt. Ltd.,"6,00,000 - 12,00,000 PA."
767,"Urgent Opening - .NET CORE, C# developer",Experteye Consulting,"10,00,000 - 12,00,000 PA."
769,Job opportunity-Maximo Developer (Multple positions)-ON Contact Basis,Wise Men Consulting Service India LLP,"6,00,000 - 16,00,000 PA."
772,Sybase SQL with Post trade/ settlement Data Analyst,Larsen & Toubro Infotech Limited,1 Cr and above PA.
776,Senior Full stack developer (Node/React),Vijaya Management Services,"10,00,000 - 18,00,000 PA."
780,ReactJS Developer,ICICLE TECHNOLOGIES PRIVATE LIMITED,"5,50,000 - 14,00,000 PA."
784,Opening For Sr Lighting,Goldstone Technologies Limited,"5,00,000 - 15,00,000 PA."
789,Opening For Sr Lighting,Goldstone Technologies Limited,"5,00,000 - 15,00,000 PA."
790,JOB OPENING_JAVA DEVELOPER_CTS_C2H_PAN INDIA_read JD & APLY,MILLION MINDS INFOTECH PRIVATE LIMITED,"50,000 - 3,00,000 PA."
791,Azure Data Architect,ProArch IT Solutions Private Limited,"2,00,000 - 4,00,000 PA."
792,Azure Data Bricks Developer,Wipro Infotech,"8,50,000 - 18,50,000 PA."
793,Pega,Wipro Infotech,"8,00,000 - 18,00,000 PA."
795,React Js Developer,CBNITS INDIA PRIVATE LIMITED,"2,00,000 - 7,00,000 PA."
797,Flutter Developer,CBNITS INDIA PRIVATE LIMITED,"3,00,000 - 8,00,000 PA."
808,Opening For Java(Immediate joiner or maximum 10 Days),BAHWAN CYBERTEK PRIVATE LIMITED,"3,00,000 - 8,00,000 PA."
813,"SSE / LEAD - MAINFRAME,COBOL,DB2 - 8+ YRS - CONTRACT",GSN Consulting,"10,00,000 - 12,00,000 PA."
814,BORN - Hunting For E-Commerce Project Managers,BORN Commerce Private Limited,"12,00,000 - 22,00,000 PA."
816,BORN Group - Salesforce Platinum Partner looking For SFCC Expertise,BORN Commerce Private Limited,"10,00,000 - 20,00,000 PA."
818,Performance testing openings with Top MNC's,Future Focus Infotech Pvt. Ltd.,"5,00,000 - 15,00,000 PA."
820,Technical Solution Architect - Dynamics 365,To Increase,"18,00,000 - 33,00,000 PA."
827,Angular Developer | MEAN Stack | Strong knowledge of JavaScript,Blockchain Solutions,"6,00,000 - 12,00,000 PA."
829,Oracle Fusion HCM Techno Functional,SUNERA TECHNOLOGIES PVT LTD ( UNIT-II),"8,00,000 - 18,00,000 PA."
830,Urgent opening For Java Developer Pan India,Future Focus Infotech Pvt. Ltd.,"3,00,000 - 6,50,000 PA."
833,PeopleSoft FSCM Techno Functional / Functional,SUNERA TECHNOLOGIES PVT LTD ( UNIT-II),"5,00,000 - 15,00,000 PA."
834,Urgent Opening For RPA/Trubot Product Analyst with Datamatics -Andheri,Datamatics Global services Ltd.,"8,00,000 - 15,00,000 PA."
835,Node JS Full stack Developer (Work from Home),Biz HR IT Solutions,"7,00,000 - 17,00,000 PA."
843,Urgent openings For SAP S4HANA Consultant (Techno-Functional) i,Vijaya Management Services,"3,00,000 - 8,00,000 PA."
848,Opening For Product Pre-Sales with Datamatics - Andheri(east),Datamatics Global services Ltd.,"10,00,000 - 18,00,000 PA."
849,Opening For BA_Product Implementation with Datamatics - Andheri(east),Datamatics Global services Ltd.,"6,00,000 - 15,00,000 PA."
850,Opening For Product Implementation Technical with Datamatics - Andheri,Datamatics Global services Ltd.,"6,00,000 - 15,00,000 PA."
851,Huge openings on Seeburger,Larsen & Toubro Infotech Limited,"50,000 - 2,00,000 PA."
865,Marketing Manager,Manipal Technologies Limited,"10,00,000 - 18,00,000 PA."
874,Customer Service Representative,Trigent Software,"1,25,000 - 3,75,000 PA."
875,Customer Service Representative,Trigent Software,"1,25,000 - 3,75,000 PA."
876,Customer Service Representative,Trigent Software,"1,25,000 - 3,75,000 PA."
893,PHP Developer,RANDSTAD INDIA PVT LTD,"2,25,000 - 4,50,000 PA."
906,Opportunity For Machine Learning,V2Solutions,"8,00,000 - 18,00,000 PA."
907,Opportunity For RPA Developer,V2Solutions,"5,00,000 - 10,00,000 PA."
908,Urgent Opening with V2 Solutions For Backend Developer,V2Solutions,"3,00,000 - 8,00,000 PA."
916,Head of IT Application Services,Piramal Glass,"32,50,000 - 40,00,000 PA."
917,Opening For Business Development Executive,Cyber Managers Software Services Pvt. Ltd.,"2,00,000 - 4,50,000 PA."
920,Head of IT Application Services,Piramal Glass,"32,50,000 - 40,00,000 PA."
921,Opening For Business Development Executive,Cyber Managers Software Services Pvt. Ltd.,"2,00,000 - 4,50,000 PA."
926,Senior SEO Executive - WFH,31West Global Services,"3,00,000 - 6,00,000 PA."
933,Opportunity For Project Manager - Immediate Joiner,Infogain India (P) Ltd.,"12,00,000 - 20,00,000 PA."
951,SAP ABAP Developer with Quinnox Consultancy Services,Quinnox Consultancy Services Limited,"2,00,000 - 7,00,000 PA."
960,SAP ABAP Developer with Quinnox Consultancy Services,Quinnox Consultancy Services Limited,"2,00,000 - 7,00,000 PA."
975,Back Office Executive,Trigent Software,"50,000 - 1,50,000 PA."
1060,Software Engineer C++,ITIVITI INDIA PRIVATE LIMITED,"15,00,000 - 27,50,000 PA."
1063,Java full stack developer,NESS TECHNOLOGIES (INDIA) PRIVATE LIMITED,"4,50,000 - 9,00,000 PA."
1064,Deputy Manager Sales,Pearson Education India,"4,00,000 - 9,00,000 PA."
1067,US IT Technical Recruiter,ml Outsourcing Services Pvt. Ltd.,"2,75,000 - 7,00,000 PA."
1068,Assistant Sales Manager,VMC TECHNOLOGIES PRIVATE LIMITED,"1,00,000 - more than 3,00,000 PA."
1074,MVC Developer,ANASOFTECH PVT. LTD,"5,00,000 - 10,00,000 PA."
1077,Java Developer / Fullstack developer,Survik Software Pvt Ltd,"3,50,000 - 8,50,000 PA."
1079,Immediate Vacancy For Java_Microservices_MNC_C2H,Sureminds Solutions Pvt. Ltd.,"50,000 - 1,00,000 PA."
1081,Java Developer / Fullstack developer,Survik Software Pvt Ltd,"3,50,000 - 8,50,000 PA."
1083,Immediate Vacancy For Java_Microservices_MNC_C2H,Sureminds Solutions Pvt. Ltd.,"50,000 - 1,00,000 PA."
1091,Job Opportunity:: Future Focus Infotech:: SAP Consultant:: PAN India,Future Focus Infotech Pvt. Ltd.,"2,50,000 - 6,50,000 PA."
1094,IBM ODM,AG Technologies pvt Ltd,"7,00,000 - 17,00,000 PA."
1095,IBM Data Power,AG Technologies pvt Ltd,"5,00,000 - 15,00,000 PA."
1097,Immediate Requirement For JAVA-Developer-MNC-Wissen Technology,Wissen Technology,"5,00,000 - 15,00,000 PA."
1098,IBM Data Power,AG Technologies pvt Ltd,"5,00,000 - 15,00,000 PA."
1100,IBM Data Power,AG Technologies pvt Ltd,"5,00,000 - 15,00,000 PA."
1102,Full Stack Developer,avocado labs,"6,00,000 - 13,00,000 PA."
1105,Lead Software Engineer,Newfold Digital,"20,00,000 - 25,00,000 PA."
1106,Sr. React JS Developer,Fugetron Corporation,"10,00,000 - 20,00,000 PA."
1118,"Software Developer - C#, XML, XPath, Java scrip (6 months - 2 year)",Innodata India Pvt. Ltd.,"3,00,000 - 4,50,000 PA."
1130,LTI-Hiring Teradata Professionals !!,Larsen & Toubro Infotech Limited,"10,00,000 - 20,00,000 PA."
1131,LTI-Hiring Teradata Professionals !!,Larsen & Toubro Infotech Limited,"10,00,000 - 20,00,000 PA."
1134,Immediate Requirement For .Net Developer with Azure,BRISKWIN IT SOLUTIONS PRIVATE LIMITED,"7,00,000 - 17,00,000 PA."
1135,Immediate Requirement For MS Dynamics with .Net,BRISKWIN IT SOLUTIONS PRIVATE LIMITED,"5,00,000 - 15,00,000 PA."
1137,Immediate Requirement For MS Dynamics Consultants,BRISKWIN IT SOLUTIONS PRIVATE LIMITED,"10,00,000 - 18,00,000 PA."
1149,"Virtual Drive ETL Testing With Hexaware Tech. Chennai, Pune & Mumbai",Hexaware Technologies Ltd.,"2,50,000 - 7,50,000 PA."
1151,Business Analyst,HEXAWARE TECHNOLOGIES LIMITED,"10,00,000 - 19,00,000 PA."
1191,Blueprism Certified For L3 Support,HEXAWARE TECHNOLOGIES LIMITED,"9,00,000 - 15,00,000 PA."
1192,Celonis Professional-Developer/Business Analyst,HEXAWARE TECHNOLOGIES LIMITED,"7,00,000 - 15,00,000 PA."
1194,Hexaware is Hiring SQL Developers,Hexaware Technologies Ltd.,"10,00,000 - 20,00,000 PA."
1196,Urgent Hiring Freshers For Contract position_Pune Location,RANDSTAD INDIA PVT LTD,"2,00,000 - 2,50,000 PA."
1197,Business Analyst with HR Domain Experience,HEXAWARE TECHNOLOGIES LIMITED,"10,00,000 - 20,00,000 PA."
1201,MNC Hiring For PEGA Business Analyst-Immediate Joiner,GR consultants,"14,00,000 - 24,00,000 PA."
1206,D365 ERP Technical Developer,Cmm5 Level,"5,50,000 - 15,00,000 PA."
1207,D365 ERP,CMM5 Level,"7,00,000 - 17,00,000 PA."
1208,D365 ERP Functional- Finance,CMM5 Level Company,"5,00,000 - 15,00,000 PA."
1210,Magento Developer 2.0 (Remote Work),www.homespice.com,"5,00,000 - 7,00,000 PA."
1217,Salesforce Lightning Developer,Elgebra,"3,00,000 - 8,00,000 PA."
1218,QA Engineer - Manual Testing,First Insight Software Solutions (I) Pvt. Ltd.,"2,00,000 - 7,00,000 PA."
1221,Software Engineer (Sr .NET),Clarion Technologies Pvt Ltd,"2,00,000 - 7,00,000 PA."
1222,Software Engineer (.NET Core),Clarion Technologies Pvt Ltd,"2,00,000 - 7,00,000 PA."
1225,Opening For MDM Admin,Goldstone Technologies Limited,"8,00,000 - 18,00,000 PA."
1226,React.js Fullstack Developer openings with Top MNC's,Future Focus Infotech Pvt. Ltd.,"7,00,000 - 17,00,000 PA."
1227,Service now Developer,Avantha Technologies Limited,"3,00,000 - 5,50,000 PA."
1231,Immediate Requirement For Embedded Developer,Teamware Solutions ( A division of Quantum Leap Co nsulting Private LTD).,"6,00,000 - 7,50,000 PA."
1234,Immediate Joiners| Best compensation in the Industry| Product Company,milestone internet marketing pvt ltd,"15,00,000 - 30,00,000 PA."
1235,Urgent Opening For Product Analyst,Datamatics Global services Ltd.,"50,000 - 1,25,000 PA."
1236,Senior ETL Developer - Remote,TMOTIONS GLOBAL PVT. LTD.,"5,00,000 - 10,00,000 PA."
1240,Senior ETL Developer - Remote,TMOTIONS GLOBAL PVT. LTD.,"5,00,000 - 10,00,000 PA."
1249,"API Integration Engineer For ReverseLogix India, Gurgaon",REVERSELOGIX MANAGEMENT INDIA PRIVATE LIMITED,"8,00,000 - 18,00,000 PA."
