,jobTitle,company,salary
13056,Urgent opening For Manager Tax Compliance(UK),Blenheim Chalcot IT Services India Private Limited,"9,00,000 - 11,00,000 PA."
13057,Urgent Opening For Senior Finance Manager,Blenheim Chalcot IT Services India Private Limited,"9,00,000 - 11,00,000 PA."
13302,Senior Developer,Intertek India Pvt. Ltd.,"6,50,000 - 9,50,000 PA."
13303,Technical Writer/Instructional Designer (1-3 Years),ibruk Consulting Pvt Ltd,"1,75,000 - more than 3,00,000 PA."
13304,Senior Quality Analyst,Fugetron Corporation,"6,00,000 - 10,00,000 PA."
13310,Oracle Application Technical Consultant,NTSSOFTPRO SOLUTIONS LLP,"3,00,000 - 8,00,000 PA."
13313,Urgent opening For Fresher Java Developer For Bhandup location,Boppo Technologies Private Limited,"50,000 - 1,75,000 PA."
13320,GIS Software Developer / .Net Developer : Navi Mumbai,Globalsoft Infosystems,"3,00,000 - 8,00,000 PA."
13321,C++ 3D Visuali ation,IT and business consulting services,"14,00,000 - 20,00,000 PA."
13322,Software Development Senior Manager,Leading provider of technology products and services to the travel and transport industry.,"20,00,000 - 25,00,000 PA."
13331,Sr. ASP .Net / MVC Angular Developer,Nimbus Technology,"3,00,000 - 7,00,000 PA."
13341,Oracle Application Technical Consultant,NTSSOFTPRO SOLUTIONS LLP,"3,00,000 - 8,00,000 PA."
13344,Urgent opening For Fresher Java Developer For Bhandup location,Boppo Technologies Private Limited,"50,000 - 1,75,000 PA."
13353,MDM manager,Naukri Premium - Employer Services,"15,00,000 - 25,00,000 PA."
13355,GIS Software Developer / .Net Developer : Navi Mumbai,Globalsoft Infosystems,"3,00,000 - 8,00,000 PA."
13356,C++ 3D Visuali ation,IT and business consulting services,"14,00,000 - 20,00,000 PA."
13357,Software Development Senior Manager,Leading provider of technology products and services to the travel and transport industry.,"20,00,000 - 25,00,000 PA."
13366,Sr. ASP .Net / MVC Angular Developer,Nimbus Technology,"3,00,000 - 7,00,000 PA."
13387,"Implementation Analyst/Lead Analyst(XML, API, webservices)",Accelya Solutions India Limited,"5,00,000 - 15,00,000 PA."
13508,Looking For Sr SAP CRM Functional Consultant,ABM Knowledgeware Ltd,"5,00,000 - 15,00,000 PA."
13517,Looking For Solman Consultant- Mumbai,ABM Knowledgeware Ltd,"5,00,000 - 15,00,000 PA."
13818,Tech Lead - MEAN Stack Development,Wishto Internet,"12,00,000 - 14,00,000 PA."
13860,Senior Full Stack Engineer,Heady Technologies Consultancy Pvt. Ltd.,"18,00,000 - 22,50,000 PA."
13885,Tech Lead - MEAN Stack Development,Wishto Internet,"12,00,000 - 14,00,000 PA."
13918,Career Opportunity For Scanner Technician with AIRA MATRIX_Thane,AIRAMATRIX PRIVATE LIMITED,"1,00,000 - 6,00,000 PA."
13923,"PHP Developer, Junior PHP Developer, Php Fresher, PHP Programmer",Softaculous Ltd,"3,00,000 - 6,50,000 PA."
13950,Career Opportunity For Scanner Technician with AIRA MATRIX_Thane,AIRAMATRIX PRIVATE LIMITED,"1,00,000 - 6,00,000 PA."
13964,Opportunity For IT Audit / Security Analyst,63 moons technologies Limited,"3,50,000 - 4,50,000 PA."
14008,Application Support Engineer,Cubictree Technology Solutions Pvt.Ltd.,"5,00,000 - 9,50,000 PA."
14033,Looking For .NET Developers For Leader in BFSI Industry For Mumbai,Clover Infotech Pvt Ltd,"1,00,000 - 4,00,000 PA."
14035,Urgent Hiring For SAP FICO S4 HANA Consultant in Rigved Technologies,RIGVED TECHNOLOGIES PRIVATE LIMITED,"6,00,000 - 11,00,000 PA."
14041,Looking For .NET Developers For Leader in BFSI Industry For Mumbai,Clover Infotech Pvt Ltd,"1,00,000 - 4,00,000 PA."
14043,Urgent Hiring For SAP FICO S4 HANA Consultant in Rigved Technologies,RIGVED TECHNOLOGIES PRIVATE LIMITED,"6,00,000 - 11,00,000 PA."
14055,software development based on Kony systems Opening For Techmahindra,IT Source Technologies Ltd,"11,00,000 - 17,00,000 PA."
14164,"Immediate joiners required: SVN,Maven,Jenkins, Linux.",Accelya Solutions India Limited,"5,00,000 - 11,00,000 PA."
14199,Java Developer,MI Lifestyle Marketing Global Private Limited,"1,00,000 - 1,75,000 PA."
14202,Java Developer,MI Lifestyle Marketing Global Private Limited,"1,00,000 - 1,75,000 PA."
14234,Java Developer,MI Lifestyle Marketing Global Private Limited,"1,00,000 - 1,75,000 PA."
14257,Java Developer,MI Lifestyle Marketing Global Private Limited,"1,00,000 - 1,75,000 PA."
14301,PHP Developer,Softaculous Ltd,"2,00,000 - 5,00,000 PA."
14326,PHP Developer,Softaculous Ltd,"2,00,000 - 5,00,000 PA."
14569,Mobile Application Developer using flutter,Collective S Software Pvt Ltd,"90,000 - 1,50,000 PA."
14800,Massive hiring For Tech Developer - Apply Now,LA Esfera,"2,25,000 - 5,50,000 PA."
14801,"Manual Test Engineer - Banking Domain(NEFT, RTGS, IMPS, UPI)",Apmosys Technologies Pvt. Ltd.,"2,00,000 - 4,00,000 PA."
14860,Immediate Joiner _SQL DBA@ Thane,Kale Logistics Solutions Pvt Ltd,"4,00,000 - 7,00,000 PA."
14861,Hybrid Mobile App Developer _Immediate Joiners required!,Kale Logistics Solutions Pvt Ltd,"4,00,000 - 6,00,000 PA."
14863,Full Stack WordPress Developer,UPLERS SOLUTIONS PRIVATE LIMITED,"25,00,000 - 30,00,000 PA."
14864,Software Developer - WordPress,UPLERS SOLUTIONS PRIVATE LIMITED,"25,00,000 - 30,00,000 PA."
14865,Full Stack Developer - WordPress,UPLERS SOLUTIONS PRIVATE LIMITED,"25,00,000 - 30,00,000 PA."
14866,"Technical Content Lead(DevOps, Azure)",Experteye Consulting,"3,25,000 - 8,00,000 PA."
14867,Management Representative (QMS),Portall Infosystems Pvt Ltd,"12,00,000 - 15,00,000 PA."
14868,Massive hiring For Tech Developer - Apply Now,LA Esfera,"2,25,000 - 5,50,000 PA."
14869,"Manual Test Engineer - Banking Domain(NEFT, RTGS, IMPS, UPI)",Apmosys Technologies Pvt. Ltd.,"2,00,000 - 4,00,000 PA."
14883,Hiring For Sr SAP Project Manager,ABM Knowledgeware Ltd,"15,00,000 - 25,00,000 PA."
14919,Hiring For Sr SAP Project Manager,ABM Knowledgeware Ltd,"15,00,000 - 25,00,000 PA."
14928,Hiring For Sr SAP Project Manager,ABM Knowledgeware Ltd,"15,00,000 - 25,00,000 PA."
15080,Senior Python developer,RM Global Consulting,"7,00,000 - 16,00,000 PA."
15082,Accounts Executive,Nexsus Techno Solutions Pvt. Ltd.,"2,00,000 - 3,00,000 PA."
15084,Full Stack Developer - Python,Collective S Software Pvt Ltd,"6,50,000 - 15,00,000 PA."
15088,AutoCAD Draughtsman - Piping,Equator Property Managers Pvt. Ltd.,"3,00,000 - more than 3,00,000 PA."
15102,Software Manual tester (BFSI Domain),Apmosys Technologies Pvt. Ltd.,"2,50,000 - 5,00,000 PA."
15104,Wordpress Developer,UPLERS SOLUTIONS PRIVATE LIMITED,"25,00,000 - 30,00,000 PA."
15105,Senior Python developer,RM Global Consulting,"7,00,000 - 16,00,000 PA."
15107,Accounts Executive,Nexsus Techno Solutions Pvt. Ltd.,"2,00,000 - 3,00,000 PA."
15109,Full Stack Developer - Python,Collective S Software Pvt Ltd,"6,50,000 - 15,00,000 PA."
15113,AutoCAD Draughtsman - Piping,Equator Property Managers Pvt. Ltd.,"3,00,000 - more than 3,00,000 PA."
15295,Urgent opening For SAP SD S4 HANA in Rigved Technologies Pvt Ltd//WFH,RIGVED TECHNOLOGIES PRIVATE LIMITED,"5,00,000 - 12,00,000 PA."
15309,Urgent opening For SAP SD S4 HANA in Rigved Technologies Pvt Ltd//WFH,RIGVED TECHNOLOGIES PRIVATE LIMITED,"5,00,000 - 12,00,000 PA."
15327,Redhat Technical Support Engineer - Mumbai,Softaculous Ltd,"1,75,000 - 4,00,000 PA."
15353,Redhat Technical Support Engineer - Mumbai,Softaculous Ltd,"1,75,000 - 4,00,000 PA."
15545,Java developer_Interview on Fifteen May 2021_ immediate joiner,CBSI India Pvt. Ltd.,"2,00,000 - 6,00,000 PA."
15547,Immediate Hiring - Sr. Consultant - Oracle Agile PLM,RIGVED TECHNOLOGIES PRIVATE LIMITED,"10,00,000 - 20,00,000 PA."
15556,Project Manager ( IT Insurance Domain P&C),Cogitate Technology Solutions (I) Pvt. Ltd.,"15,00,000 - 20,00,000 PA."
15557,QA Manager,Cogitate Technology Solutions (I) Pvt. Ltd.,"20,00,000 - 25,00,000 PA."
15559,Software Developer - NodeJS,Logicloop Digital,"4,50,000 - 7,00,000 PA."
15560,"Software Development Engineer, Mumbai",Accelya Solutions India Limited,"4,50,000 - 6,50,000 PA."
15575,Android Developer,MI Lifestyle Marketing Global Private Limited,"1,50,000 - 2,25,000 PA."
15590,Android Developer,MI Lifestyle Marketing Global Private Limited,"1,50,000 - 2,25,000 PA."
15601,Software Developer - NodeJS,Logicloop Digital,"4,50,000 - 7,00,000 PA."
15602,"Software Development Engineer, Mumbai",Accelya Solutions India Limited,"4,50,000 - 6,50,000 PA."
15617,Android Developer,MI Lifestyle Marketing Global Private Limited,"1,50,000 - 2,25,000 PA."
15632,NOC Engineer,Eclinicalworks India Pvt Ltd,"3,50,000 - 5,00,000 PA."
15683,NOC Engineer,Eclinicalworks India Pvt Ltd,"3,50,000 - 5,00,000 PA."
15691,ASP.NET Developer,Inogic Tech (India) Pvt. Ltd.,"2,00,000 - 6,00,000 PA."
15695,Tenders || Bid Executive - Mumbai,Cloudstrats Technologies Private Limited,"1,25,000 - 2,00,000 PA."
15697,Insurance Executive,AGS Transact Technologies Limited,"4,00,000 - 5,00,000 PA."
15771,System Administrator,Eclinicalworks India Pvt Ltd,"4,00,000 - 6,50,000 PA."
15776,Senior Backend Engineer (Node.js),Heady Technologies Consultancy Pvt. Ltd.,"16,00,000 - 31,00,000 PA."
15800,System Administrator,Eclinicalworks India Pvt Ltd,"4,00,000 - 6,50,000 PA."
15805,Senior Backend Engineer (Node.js),Heady Technologies Consultancy Pvt. Ltd.,"16,00,000 - 31,00,000 PA."
15884,Project Manager-Data Scientist,Gravitas Technology Private Limited -Linedata,"15,00,000 - 25,00,000 PA."
15900,SAP CS Senior Consultants For Mumbai,Solsynch Technologies Private Limited,"8,00,000 - 12,00,000 PA."
15903,"Full Stack Developer (PHP, Laravel, MySQL)",App Octet Technologies Pvt Ltd,"3,00,000 - 4,50,000 PA."
15911,Project Manager-Data Scientist,Gravitas Technology Private Limited -Linedata,"15,00,000 - 25,00,000 PA."
15921,Senior Backend Engineer (PHP & Laravel),Heady Technologies Consultancy Pvt. Ltd.,"16,00,000 - 31,00,000 PA."
16069,Dot Net Developer,Sm2 Infotech,"3,00,000 - 5,50,000 PA."
16071,Senior UI Developer,Web Arcitech,"3,00,000 - 6,00,000 PA."
16075,Job Opportunities For Fresher's | Software Company | Navi Mumbai,CALIBEHR BUSINESS SUPPORT SERVICES PRIVATE LIMITED,"1,00,000 - 1,75,000 PA."
16077,Netapp Storage Administrator,Hitachi systems micro clinic pvt ltd,"5,00,000 - 10,00,000 PA."
16079,Product Executive/Area Sales Manager,Redington (INDIA) Limited,"2,50,000 - 5,00,000 PA."
16115,Dot Net Developer,Sm2 Infotech,"3,00,000 - 5,50,000 PA."
16117,Senior UI Developer,Web Arcitech,"3,00,000 - 6,00,000 PA."
16381,Opening For Finacle 10X Customization-Remote,Nelito Systems Ltd,"4,25,000 - 9,00,000 PA."
16382,Technical Lead - Java J2ee,Expenzing,"18,00,000 - 22,50,000 PA."
16383,Opening For Finacle 10X Customization-Mumbai,Nelito Systems Ltd,"4,25,000 - 9,00,000 PA."
16386,Software Engineer (Frontend Developer) - (Work from Home) - E comm,NEWAGE PRODUCT DESIGNS PRIVATE LIMITED,"5,00,000 - 7,00,000 PA."
16387,Software Engineer (Backend Developer) - (Work from Home) - E commerce,NEWAGE PRODUCT DESIGNS PRIVATE LIMITED,"5,00,000 - 6,00,000 PA."
16390,International Corporate sales roles: Remote,ECOMMERCE CONSULTANTS PRIVATE LIMITED,"4,00,000 - 9,00,000 PA."
16391,Mysql Database Administrator,Finicity Technologies Pvt Ltd.,"7,50,000 - 12,00,000 PA."
16394,Business Development Manager - Mumbai,Geotrackers Mobile Resource Management Pvt. Ltd.,"5,00,000 - 12,00,000 PA."
16395,C#.Net Developer,Santronix,"1,75,000 - 3,75,000 PA."
16396,PHP Web Developer,Netsearch India,"2,00,000 - 2,50,000 PA."
16397,Senior Frontend Developer (ReactJS) - Remote OK,SHUJABITS INFOTECH SOLUTIONS PRIVATE LIMITED,"2,00,000 - 7,00,000 PA."
16398,Key Account Manager / Sr.Business Development,PagarBook (India's No.1 Trusted Software for Staff Management),"3,00,000 - 5,00,000 PA."
16399,Deputy Business Analyst - Andheri East,63 moons technologies Limited,"3,00,000 - 6,50,000 PA."
16400,"Urgent Requirements at Intelegain Technologies, Navi Mumbai",Intelegain Technologies Pvt ltd,"5,00,000 - 15,00,000 PA."
16401,Hiring For WAS Admin,Fidelis Corporate Solutions Pvt Ltd,"7,00,000 - 9,00,000 PA."
16404,Full Stack Developer,Appetals Solutions Private Limited,"4,00,000 - 6,00,000 PA."
16405,"Urgently Required For Senior UX Designer @ Vashi, Navi Mumbai",Karvy Infotech Private Limited,"6,00,000 - 12,00,000 PA."
16414,Inside Sales Representative,Aakit Technologies Pvt. Ltd.,"2,50,000 - 4,25,000 PA."
16419,Senior iOS Engineer,Heady Technologies Consultancy Pvt. Ltd.,"11,00,000 - 21,00,000 PA."
16441,Business Development Manager - Mumbai,Geotrackers Mobile Resource Management Pvt. Ltd.,"5,00,000 - 12,00,000 PA."
16442,C#.Net Developer,Santronix,"1,75,000 - 3,75,000 PA."
16443,PHP Web Developer,Netsearch India,"2,00,000 - 2,50,000 PA."
16444,Senior Frontend Developer (ReactJS) - Remote OK,SHUJABITS INFOTECH SOLUTIONS PRIVATE LIMITED,"2,00,000 - 7,00,000 PA."
16445,Key Account Manager / Sr.Business Development,PagarBook (India's No.1 Trusted Software for Staff Management),"3,00,000 - 5,00,000 PA."
16446,Deputy Business Analyst - Andheri East,63 moons technologies Limited,"3,00,000 - 6,50,000 PA."
16447,"Urgent Requirements at Intelegain Technologies, Navi Mumbai",Intelegain Technologies Pvt ltd,"5,00,000 - 15,00,000 PA."
16448,Hiring For WAS Admin,Fidelis Corporate Solutions Pvt Ltd,"7,00,000 - 9,00,000 PA."
16451,Full Stack Developer,Appetals Solutions Private Limited,"4,00,000 - 6,00,000 PA."
16452,"Urgently Required For Senior UX Designer @ Vashi, Navi Mumbai",Karvy Infotech Private Limited,"6,00,000 - 12,00,000 PA."
16461,Inside Sales Representative,Aakit Technologies Pvt. Ltd.,"2,50,000 - 4,25,000 PA."
16466,Senior iOS Engineer,Heady Technologies Consultancy Pvt. Ltd.,"11,00,000 - 21,00,000 PA."
16546,Dot Net Developer - Fullstack ( For Leading Testing Inspection Company,OASIS,"12,00,000 - 13,00,000 PA."
16584,Senior Devops Engineer,Heady Technologies Consultancy Pvt. Ltd.,"10,00,000 - 20,00,000 PA."
16741,"Urgently Hiring For Full Stack Developer (Nodejs, Reactjs, NextJS)",Karvy Infotech Private Limited,"5,00,000 - 12,00,000 PA."
16775,"Urgently Hiring For Full Stack Developer (Nodejs, Reactjs, NextJS)",Karvy Infotech Private Limited,"5,00,000 - 12,00,000 PA."
16816,Automation Test Engineer,Acme Services,"8,00,000 - 18,00,000 PA."
16817,Excellent Opportunity For Flutter Developer with leading IT Company,Acme Services,"1,50,000 - 6,50,000 PA."
16818,PMO Opportunity With Leading IT Firm,Acme Services,"10,00,000 - 15,00,000 PA."
16819,Blockchain Developer with leading IT software company,Acme Services,"2,00,000 - 7,00,000 PA."
16821,HR Executive with Spine HRMS Knowledge,Modern Informatics Pvt. Ltd.,"1,25,000 - 3,25,000 PA."
16868,HR Executive with Spine HRMS Knowledge,Modern Informatics Pvt. Ltd.,"1,25,000 - 3,25,000 PA."
16960,Senior Software Engineer,RIGVED TECHNOLOGIES PRIVATE LIMITED,"8,00,000 - 17,00,000 PA."
16961,Site Reliability Engineer (Systems Engineer) - AWS,RIGVED TECHNOLOGIES PRIVATE LIMITED,"20,00,000 - 30,00,000 PA."
16991,Senior Front End Engineer,Heady Technologies Consultancy Pvt. Ltd.,"12,00,000 - 18,00,000 PA."
16998,"Subject Matter Experts - Business Management (MBA, LLM)",GoAskNow,"2,00,000 - more than 3,00,000 PA."
16999,Hiring For C Developer - Mumbai,NSEIT LTD,"4,00,000 - 7,50,000 PA."
17000,Hiring For C Lead - Mumbai,NSEIT LTD,"8,00,000 - 12,00,000 PA."
17001,Senior Technology Specialist App Hosting Support & Build/Release Mgmt.,Enlighta,"4,00,000 - 9,00,000 PA."
17005,Sales Executive,IInfrasol Services,"2,75,000 - 4,50,000 PA."
17041,Senior Software Engineer,RIGVED TECHNOLOGIES PRIVATE LIMITED,"8,00,000 - 17,00,000 PA."
17042,Site Reliability Engineer (Systems Engineer) - AWS,RIGVED TECHNOLOGIES PRIVATE LIMITED,"20,00,000 - 30,00,000 PA."
17063,"Devops Specialist - (Jenkins, Weblogic, Jboss) For Mumbai.",Accelya Solutions India Limited,"8,50,000 - 18,00,000 PA."
17127,"Devops Specialist - (Jenkins, Weblogic, Jboss) For Mumbai.",Accelya Solutions India Limited,"8,50,000 - 18,00,000 PA."
17220,Salesforce Developer,Aeonx Digital Solutions,"3,00,000 - 5,00,000 PA."
17221,Assistant Editor,ECOMMERCE CONSULTANTS PRIVATE LIMITED,"2,00,000 - 7,00,000 PA."
17235,Dot Net Developer on MNC client Payroll-Mumbai,RIGVED TECHNOLOGIES PRIVATE LIMITED,"50,000 - 70,000 PA."
17237,SAP Fiori Developer,Exalca Technologies Private Limited,"3,25,000 - 8,00,000 PA."
17239,Opening For Java/Fullstack Java/Java Devops Developer_Mumbai/Chennai,Net Connect Pvt Ltd,"9,00,000 - 18,00,000 PA."
17243,Salesforce Developer,NEURONIMBUS SOFTWARE SERVICES PRIVATE LIMITED,"10,00,000 - 14,00,000 PA."
17256,UI/UX Developer & Lead,AZENTIO SOFTWARE PRIVATE LIMITED,"5,00,000 - 10,00,000 PA."
17298,Salesforce Developer,NEURONIMBUS SOFTWARE SERVICES PRIVATE LIMITED,"10,00,000 - 14,00,000 PA."
17393,Senior Android Engineer,Heady Technologies Consultancy Pvt. Ltd.,"12,00,000 - 16,00,000 PA."
17520,Flutter Developer,M/s. CDP (I) Pvt. Ltd.,"2,00,000 - 7,00,000 PA."
17522,Urgent Requirement For Full Stack Java Developer @ Vashi location.,Karvy Infotech Private Limited,"5,00,000 - 12,00,000 PA."
17523,"Software Developer (C#, .Net)",Sectona Technologies Pvt Ltd,"3,00,000 - 5,50,000 PA."
17524,IT Risk Analyst,Karza Technologies Private Limited,"3,00,000 - 5,00,000 PA."
17525,Business Development Executive,CiELO Technologies,"2,00,000 - 3,00,000 PA. (Including Variable: 30.0%)"
17526,Executive Finance & Accounts(Collection),CENVEO PUBLISHER SERVICES INDIA PRIVATE LIMITED,"4,00,000 - 8,00,000 PA."
17527,Urgently looking For Full Stack Java Developer @ Vashi location.,Karvy Infotech Private Limited,"5,00,000 - 12,00,000 PA."
17528,HR Executive,Webenetic Pvt Ltd,"2,50,000 - 3,00,000 PA."
17529,Looking For C/C++ Developer,NSEIT LTD,"2,00,000 - 7,00,000 PA."
17533,Unity Game Developers,IDZ Digital Private Limited,"1,50,000 - more than 3,00,000 PA."
17534,ASO and Digital Marketing Executive,IDZ Digital Pvt. Ltd,"1,50,000 - 2,50,000 PA."
17709,c# MVC Microservices full-stack Developer,NetGains Technologies Pvt. Ltd.,"2,00,000 - 5,00,000 PA."
17770,Datamatics Global Services is hiring For Asp.net Developers,Datamatics Global services Ltd.,"5,00,000 - 15,00,000 PA."
17771,Senior Software Development Engineer,MARSH MCLENNAN GLOBAL SERVICES INDIA PRIVATE LIMITED,"7,00,000 - 10,00,000 PA."
17773,Urgent Opening For Google Cloud Architect,DIGIFOCAL IT SOLUTIONS PRIVATE LIMITED,"20,00,000 - 25,00,000 PA."
17775,SAP SD Consultant,Aakit Technologies Pvt. Ltd.,"3,00,000 - 8,00,000 PA."
17779,Network Engineer L1,CMS IT Services Private Limited,"50,000 - 2,50,000 PA."
18066,Urgent Opening For Full Stack Developer,Lemon Yellow LLP,"3,00,000 - 8,00,000 PA."
18067,Urgent opening For Automation Testing Fresher_Mumbai,Apmosys Technologies Pvt. Ltd.,"2,00,000 PA."
18068,Hiring For Lead - C Programming,NSEIT LTD,"6,00,000 - 15,00,000 PA."
18069,Hiring For C Developer,NSEIT LTD,"2,00,000 - 7,00,000 PA."
18071,Salesforce Administrator,CENVEO PUBLISHER SERVICES INDIA PRIVATE LIMITED,"6,00,000 - 12,00,000 PA."
18072,Tableau Developer,Future Focus Infotech Pvt. Ltd.,"4,00,000 - 7,00,000 PA."
18134,Freelance Content Writer (Work-From-Home),Authority Magnet Co.,"2,00,000 - 3,00,000 PA."
18135,Freelance Content Writer,IDZ Digital Pvt. Ltd,"1,50,000 - 3,00,000 PA."
18136,Content Creator,IDZ Digital Pvt. Ltd,"1,50,000 - 3,00,000 PA."
18137,Java Developer,IDZ Digital Pvt. Ltd,"1,50,000 - 4,00,000 PA."
18185,"Team Lead-Application Support, L2 Technical Support Enginieer",Arcon Techsolutions private limited,"6,50,000 - 9,00,000 PA."
18219,Leading MNC hiring For Platform Engineer,LIVE CONNECTIONS PLACEMENTS PRIVATE LIMITED,"8,00,000 - 16,00,000 PA."
18220,Kronos Lead and Kronos project manager,Orcapod Consulting Services Private Limited,"8,00,000 - 18,00,000 PA."
18229,Leading MNC hiring For Workday HCM professionals,LIVE CONNECTIONS PLACEMENTS PRIVATE LIMITED,"9,50,000 - 14,00,000 PA."
18230,Urgent opening For React JS/Redux/HTML/CSS/ JS Specialist,U. S. Recruitment Consultants,"15,00,000 - 20,00,000 PA."
18231,Digital Marketing Manager,JAYRAJ DAMJI CHHEDA,"4,00,000 - 6,00,000 PA."
18232,Product Manager with 7 To 10 years of relevant Work experience,JAYRAJ DAMJI CHHEDA,"12,00,000 - 16,00,000 PA."
18233,Android Developer,recruitment advisory line,"3,75,000 - 8,75,000 PA."
18234,PHP Developer,recruitment advisory line,"3,50,000 - 8,50,000 PA."
18243,SCM Functional Consultant,Orcapod Consulting Services Private Limited,"3,00,000 - 8,00,000 PA."
18246,Kronos Lead and Kronos project manager,Orcapod Consulting Services Private Limited,"8,00,000 - 18,00,000 PA."
18248,Kronos Lead and Kronos project manager,Orcapod Consulting Services Private Limited,"8,00,000 - 18,00,000 PA."
18257,Leading MNC hiring For Workday HCM professionals,LIVE CONNECTIONS PLACEMENTS PRIVATE LIMITED,"9,50,000 - 14,00,000 PA."
18258,Urgent opening For React JS/Redux/HTML/CSS/ JS Specialist,U. S. Recruitment Consultants,"15,00,000 - 20,00,000 PA."
18259,Digital Marketing Manager,JAYRAJ DAMJI CHHEDA,"4,00,000 - 6,00,000 PA."
18270,Leading MNC hiring For Platform Engineer,LIVE CONNECTIONS PLACEMENTS PRIVATE LIMITED,"8,00,000 - 16,00,000 PA."
18277,"JP-002, MEAN Stack Developer, Mumbai / Bangalore",U. S. Recruitment Consultants,"10,00,000 - 20,00,000 PA."
18278,"JP-001, Hiring React.js / Redux / HTML / CSS / JS Specialist - PAN Ind",U. S. Recruitment Consultants,"14,00,000 - 20,00,000 PA."
18286,Salesforce Marketing Cloud - Technical Lead,C P CAREERS PRIVATE LIMITED,"15,00,000 - 22,50,000 PA."
18288,Java Lead,Placewell HRD Consultants,"11,00,000 - 13,00,000 PA."
18292,Software Developer,Shrenzo careers Pvt Ltd,"4,50,000 - 9,50,000 PA."
18295,SAP Fiori/UI5 Consultant,KAPSTON FACILITIES MANAGEMENT LIMITED,"4,00,000 - 9,00,000 PA."
18296,SAP FICO Consultant,KAPSTON FACILITIES MANAGEMENT LIMITED,"6,00,000 - 16,00,000 PA."
18297,Hiring - Software Engineers,Freelancer Santhiya Suresh Babu,"6,00,000 - 10,00,000 PA."
18305,Leading MNC hiring For Workday HCM professionals,LIVE CONNECTIONS PLACEMENTS PRIVATE LIMITED,"9,50,000 - 14,00,000 PA."
18306,Urgent opening For React JS/Redux/HTML/CSS/ JS Specialist,U. S. Recruitment Consultants,"15,00,000 - 20,00,000 PA."
18307,Digital Marketing Manager,JAYRAJ DAMJI CHHEDA,"4,00,000 - 6,00,000 PA."
18308,Product Manager with 7 To 10 years of relevant Work experience,JAYRAJ DAMJI CHHEDA,"12,00,000 - 16,00,000 PA."
18309,Android Developer,recruitment advisory line,"3,75,000 - 8,75,000 PA."
18310,PHP Developer,recruitment advisory line,"3,50,000 - 8,50,000 PA."
18320,Software Developer,Shrenzo careers Pvt Ltd,"4,50,000 - 9,50,000 PA."
18323,SAP Fiori/UI5 Consultant,KAPSTON FACILITIES MANAGEMENT LIMITED,"4,00,000 - 9,00,000 PA."
18324,SAP FICO Consultant,KAPSTON FACILITIES MANAGEMENT LIMITED,"6,00,000 - 16,00,000 PA."
18325,Hiring - Software Engineers,Freelancer Santhiya Suresh Babu,"6,00,000 - 10,00,000 PA."
18330,Service Now Developer @ Jacobs Engineering- Anywhere in India,TEAMQUEST CONSULTANT PRIVATE LIMITED,"10,00,000 - 15,00,000 PA."
18335,SAP CC Techncal,FASTRA CORPORATION PRIVATE LIMITED,"12,00,000 - 15,00,000 PA."
18337,Urgent Openings For React JS Developer - 20 Positions,U. S. Recruitment Consultants,"5,00,000 - 15,00,000 PA."
18343,Salesforce Marketing Cloud - Technical Lead,C P CAREERS PRIVATE LIMITED,"15,00,000 - 22,50,000 PA."
18345,Java Lead,Placewell HRD Consultants,"11,00,000 - 13,00,000 PA."
18349,Software Developer,Shrenzo careers Pvt Ltd,"4,50,000 - 9,50,000 PA."
18352,SAP Fiori/UI5 Consultant,KAPSTON FACILITIES MANAGEMENT LIMITED,"4,00,000 - 9,00,000 PA."
18353,SAP FICO Consultant,KAPSTON FACILITIES MANAGEMENT LIMITED,"6,00,000 - 16,00,000 PA."
18354,Hiring - Software Engineers,Freelancer Santhiya Suresh Babu,"6,00,000 - 10,00,000 PA."
18368,GCP(Google Cloud Platform)-Build AND Manage,Adecco India Private Limited,"2,00,000 - 7,00,000 PA."
18369,SAP ABAP - Hana with BIG 4 Consulting,WSNE Consulting Pvt Ltd,"6,00,000 - 16,00,000 PA."
18370,Urgently Looking MS Dynamics CRM Consultant,VAS INFO SOLUTIONS PVT.LTD.,"5,00,000 - 15,00,000 PA."
18371,Business Analyst,Talent Corner HR Services Pvt Ltd,"11,00,000 - 18,00,000 PA."
18372,Hiring Angular with .Net - Remote Work,Freelancer - Dinesh Kumar Dubey,"5,00,000 - 15,00,000 PA."
18373,UI Developer - CSS / React /JavaScript,Selectica International Solutions LLP,"12,00,000 - 22,00,000 PA."
18374,SSAS Developer | MNC | 5 Days Working | Permanent Position,CHANGE LEADERS CONSULTING,"5,00,000 - 11,00,000 PA."
18375,SQL + Python developer,Talent Corner HR Services Pvt Ltd,"8,00,000 - 12,00,000 PA."
18376,Software QA Engineer,Talent Corner HR Services Pvt Ltd,"7,00,000 - 17,00,000 PA."
18378,AWS Cloud Architect (FSR),MM JAIN AGENCIES,"11,00,000 - 21,00,000 PA."
18379,Datastage (SPR),MM JAIN AGENCIES,"5,00,000 - 15,00,000 PA."
18382,Data Modelling (SSR),MM JAIN AGENCIES,"11,00,000 - 21,00,000 PA."
18383,Talend Architect (SSR),MM JAIN AGENCIES,"15,00,000 - 30,00,000 PA."
18384,Data Technical Analyst (SSR),MM JAIN AGENCIES,"5,00,000 - 15,00,000 PA."
18385,Cloud AWS Architect (SSR),MM JAIN AGENCIES,"15,00,000 - 30,00,000 PA."
18386,Cloud AWS Developer (SSR),MM JAIN AGENCIES,"8,00,000 - 15,00,000 PA."
18387,Senior Software Engineer,N Human Resources and Management Systems,"10,00,000 - 15,00,000 PA."
18389,Senior Android Developer,WAYS & WORK CONSULTING LLP,"12,00,000 - 20,00,000 PA."
18390,SiteCore Engineer- Work from Home,Freelancer - Dinesh Kumar Dubey,"5,00,000 - 15,00,000 PA."
18391,Network Security Engineer,Avanti Tech,"10,00,000 - 20,00,000 PA."
18393,Sr. Cloud Native Java Developer (CBR),MM JAIN AGENCIES,"5,00,000 - 15,00,000 PA."
18394,JavaScript Lead (CBR),MM JAIN AGENCIES,"5,00,000 - 15,00,000 PA."
18395,Cloud Native Java - Lead (CBR),MM JAIN AGENCIES,"10,00,000 - 20,00,000 PA."
18396,Hiring For MNC - Power BI/Tableau/Qlikview/MSBI/SSRS Developer,Sellcraft Global Solutions Private Limited,"3,00,000 - 8,00,000 PA."
18397,Infrastructure Lead (AWRR),MM JAIN AGENCIES,"15,00,000 - 20,00,000 PA."
18398,Cloud Architect (AWRR),MM JAIN AGENCIES,"10,00,000 - 20,00,000 PA."
18399,Product Owner (AWRR),MM JAIN AGENCIES,"25,00,000 - 30,00,000 PA."
